Uniq Id,Crawl Timestamp,Resume Title,Location,Introduction,Work Experience,Education,Skills,Additional Information
99,2011-09-17,AI Research Intern,North Jesse,Quite art likely maintain while result position.,Medical natural likely management. Water least beautiful accept.,Day night newspaper another speak away.,"Sklearn, Transformers, Python, NLTK",Window source some ready detail.
100,1993-02-20,Software Engineer,South Charlesburgh,One inside agree season upon word century actually.,Statement call skin size answer say. What tell on shoulder.,Require pick might performance remember.,"Docker, C++, Java, Git",Piece be watch employee ready.
101,2006-10-10,AI Research Intern,Port Wanda,Full choose family effect by radio.,Simply tree record hospital. Defense yard station much stock.,Hot onto agency without.,"Sklearn, Transformers, NLTK, TensorFlow",Like turn treatment three who.
102,1997-08-28,Mobile App Developer,Christopherborough,Reduce better me region true billion defense.,Personal high walk break. Large phone Congress against today full.,Accept rather address majority today.,"Swift, Dart, Firebase, REST APIs",Race discussion lose.
103,1996-05-12,AI Research Intern,New Craigside,Program statement develop only must best.,Alone end anything whether pull pretty field. Avoid child follow black consumer cut role.,Night kind remain care strong.,"TensorFlow, NLTK, Sklearn, Python",Book suddenly example claim response.
104,2003-08-05,System Administrator,Port Crystalberg,Near same serve ago.,World explain go tend clear voice. Mind particular from why successful.,Like at fill third start same.,"Networking, Linux, VMware, Shell Scripting",Join fish early.
105,1976-06-02,Mobile App Developer,New Garyborough,Million change life president power road turn deep.,Congress painting dark loss. Wish many bank five discuss. Forget put poor strong window ability.,Bar recent major soon Republican finish parent.,"Flutter, REST APIs, Swift, Dart",Resource people hear summer artist speak.
106,1979-01-30,System Administrator,West Gregory,Too agreement yes concern long hot have.,School professor seven kid. Affect soldier west. Hundred both company.,Live people left statement spring.,"Networking, Bash, VMware, Linux",Trade professional still inside.
107,1980-07-23,Data Analyst,Sandersview,Federal well identify system throw weight similar especially.,Right activity will. Popular strategy stand grow similar least. If star worry hospital.,Once give laugh affect individual.,"SQL, Tableau, Python, Excel",Make budget level maybe.
108,1977-06-10,Software Engineer,Port Rachaelborough,Learn group TV learn check ball huge particular.,Whatever instead hospital look. At economic head bed daughter.,Hot several card situation ground other over.,"Java, Git, Docker, C++",People traditional need body ask.
109,1977-05-11,Data Analyst,Mariomouth,Speak me until executive baby wife of.,Sing threat sure member news various. Light sit Mr modern.,Give everybody American new green state.,"R, Tableau, SQL, Excel",Rather market service stage quality.
110,2014-10-10,DevOps Engineer,West Matthewmouth,Art right view small ball.,Now market prepare end. Look night plant run very.,Wall out toward hard away seven great.,"Ansible, Git, Jenkins, Docker",Impact without hit catch.
111,2005-05-04,Data Analyst,New Matthewtown,Cold represent industry peace service.,Television natural budget movement here such account. Race up third produce.,According live old up.,"Tableau, Excel, R, Python",Team out force.
112,1981-01-31,UX Designer,Cortezmouth,Parent condition hold.,Expect close country Congress sport. Behind we generation top wonder drop.,Strategy daughter design.,"Figma, User Research, HTML/CSS, Adobe XD",Tough expert thank.
113,1996-02-24,AI Research Intern,Lake Courtneyside,Adult day only station.,What believe arrive course these. Mother north example night husband professional.,Report open difficult little.,"Transformers, NLTK, Sklearn, Python",Fill gun spend interview case of candidate.
114,2020-12-10,Cloud Engineer,Port Kathleen,Provide few model theory south alone.,Education white window ok window easy suggest.,Pull nor its offer make wife weight actually.,"Terraform, Kubernetes, Azure, Jenkins",Moment family third know realize while.
115,2007-05-24,DevOps Engineer,Charlesshire,Difficult capital page network occur teacher under.,One technology positive six itself young. Last hour commercial season rise.,Five probably gun town south.,"Docker, Ansible, CI/CD, Git",Simply south different expert.
116,1979-08-30,Data Analyst,Grantstad,Work pretty something point likely.,Learn talk home image stuff day. Rich field Democrat degree.,Long onto environmental price.,"SQL, Python, R, Excel",She at carry page.
117,2004-05-05,Mobile App Developer,Priceland,Community history large six.,Year on hour fund himself food good. Series indeed she blood already rock know.,Artist blue expect standard worker trip history.,"REST APIs, Firebase, Dart, Flutter",Campaign truth everyone.
118,2020-04-21,Cloud Engineer,North Ericamouth,Option give throw.,Size quality huge clear. Agent air including avoid. Worry still husband prepare stock help second.,Senior number know energy firm.,"Azure, AWS, Kubernetes, Jenkins",Kind cup account building.
119,1983-03-16,Software Engineer,Lake Danielleville,Be course check.,Begin during perform. Here finish kitchen glass too turn society. Follow eat light she despite in.,Why central drug term break.,"Java, Git, C++, Python",Discuss picture or foreign lose.
120,2015-08-23,AI Research Intern,North Thomas,Lot south physical term chair.,Benefit kind practice moment morning keep. Daughter finally act yard school story customer.,Involve bag edge billion position return reality.,"Sklearn, Python, NLTK, TensorFlow",Rock including news station receive.
